Company Name,Competitors,Founded,Headquarters,Industry,Job Description,Job Title,Location,Rating,Revenue,Salary Estimate,Sector,Size,Type of ownership
"Deutsche Bank
3.5",-1,1870,"Frankfurt am Main, Germany",Banks & Building Societies,"Job Description:


Job Title - Data Scientist

Location- Pune

Role Description


Within the HR function, we are looking for a Data Scientist who will help discover information hidden in the data available and help the business to drive the strategy with data-based insights. Data scientist must be able to apply their analytical, statistical and programming skills to collect, analyze and interpret large data sets and present the outcomes using various data visualization techniques apt for different kind of stakeholders. Data scientist then should use such outcomes to develop data driven solutions and support stakeholders to improve business outcomes.

What we’ll offer you

As part of our flexible scheme, here are just some of the benefits that you’ll enjoy

· Best in class leave policy

· Gender neutral parental leaves

· 100% reimbursement under child care assistance benefit (gender neutral)

· Flexible working arrangements

· Sponsorship for Industry relevant certifications and education

· Employee Assistance Program for you and your family members

· Comprehensive Hospitalization Insurance for you and your dependents

· Accident and Term life Insurance

Complementary Health screening for 35 yrs. and above

Areas of Specialty
Data Mining: Ability to perform statistical analysis, prepare forecasting and predictive models etc.
AI & Machine Learning: Ability to build AI Models/Machine Learning models to automate the processes and continuously enhance the model based on data changes
Programming Skills: Ability to write programs/scripts in popular scripting and programming languages
Data Profiling & Quality: Ability to perform data quality checks on the source data ensuring good data quality for the model inputs
Data Visualization: Ability to present the outcomes in the most effective way
Responsibilities
Work continuously with stakeholders to identify opportunities of leveraging data to help in business solutions and driving business strategy; in this case it will be for the HR function of a large European bank
Analyze data to find patterns by applying data mining techniques and performing statistical analysis
Build AI tools to automate the processes; create machine learning based tools or processes
Develop high quality predictive modeling systems to provide HR with crucial results helping business to take smart decisions around workforce planning e.g. identification of potential leavers/movers
Develop data collection processes from a wide variety of sources including the data verification steps to ensure bringing the right quality of data and continuous monitoring of data performance
Use third party data in collaboration with organization’s data to have better insights and comparison with industry parameters
Develop and automate testing & verification framework for testing the quality of the various models being developed or already in production
Develop smart data visualization techniques/approaches conveying the outcomes in a clear and intuitive manner
Recruit, train and lead a team of data scientists
Evaluate new and emerging technologies
Skills & Qualifications
Excellent understanding and experience with common data science tools and data mining technologies
Exposure of AI & Machine Learning techniques and algorithms
Good demonstrable experience with data visualization tools and reporting technologies
Good experience with different databases including RDBMS, NoSQL databases and formats like JSON, XML etc.
Excellent scripting and programming skills like Python, R, Java, Scala etc.
Strong analytical and problem solving skills
Proficient written and verbal communication skills
Exposure to Big Data and Business Analytics technologies
Experience with cloud technologies
Data oriented personality with a drive to learn and master new technologies
Education/Certification


Graduation/Post-graduation from an accredited college or university with a concentration in Statistics or Computer Science (or equivalent)

Deutsche Bank is an equal opportunity employer who seeks to recruit and appoint the best available person for a job regardless of marital / civil partnership status, sex (including pregnancy), age, religion, belief, race, nationality and ethnic or national origin, colour, sexual orientation or disability.

How we’ll support you

· Training and development to help you excel in your career

· Flexible working to assist you balance your personal priorities

· Coaching and support from experts in your team

· A culture of continuous learning to aid progression

· A range of flexible benefits that you can tailor to suit your needs

About us and our teams

Please visit our company website for further information:

https://www.db.com/company/company.html

Our values define the working environment we strive to create – diverse, supportive and welcoming of different views. We embrace a culture reflecting a variety of perspectives, insights and backgrounds to drive innovation. We build talented and diverse teams to drive business results and encourage our people to develop to their full potential. Talk to us about flexible work arrangements and other initiatives we offer.

We promote good working relationships and encourage high standards of conduct and work performance. We welcome applications from talented people from all cultures, countries, races, genders, sexual orientations, disabilities, beliefs and generations and are committed to providing a working environment free from harassment, discrimination and retaliation.

Click here to find out more about our diversity and inclusion policy and initiatives.",Data Scientist,Pune,3.5,₹500+ billion (INR),"INR 1,400K - INR 1,506K",Finance,10000+ employees,Company - Public
"phData
2.9",-1,2014,"Minneapolis, MN",IT Services,"About phData

We build next-generation strategic platforms helping customers to save money and unlock real business value for our customers and the community. If you are inspired by innovation, hard work, and a passion for data, we want to hear from you.
Our Commitment – you will be working in a fast-moving environment with the brightest and most experienced minds in technology. We're committed to constant learning and innovation.
Our Work – you'll be helping companies answer questions and create products that, until now, were too big, too expensive, and too complex to accomplish.
Our Technology – we focus on building and deploying disruptive big data technologies. If you have experience in or passion for Hadoop and its supporting technologies, we want to hear from you!
In addition to the phenomenal growth and learning opportunity, we offer competitive compensation and excellent perks including base salary, annual bonus, and extensive training - in addition to generous PTO, flexible hours and comprehensive Insurance cover.

Passionate about Big Data, Data Science, and Machine Learning Algorithms? Be part of a team of industry pioneering experts that operate some of the largest analytics and data science infrastructure systems at phData. Our customers apply these technologies on terabytes of data a day on petabyte-scale infrastructure.

Job Information

Technical Responsibilities
Hands-on Engineering of Data Processing applications
Experience with Big Data technologies, assisting customers in building software solutions on-prem or cloud.
Very strong understanding of SQL alongside traditional/conventional data warehousing design patterns.
Hands-on experience in developing Big Data applications using Hadoop technologies such as Spark (Scala or PySpark), Map Reduce (Java), YARN, HDFS, Hive, Impala, Sqoop, Oozie, HBase, Kudu.
Good understanding of UNIX shell scripting.
Develop analytical functionality and complex transformation that will be finally deployed in production data platforms.
Good understanding of Big data design patterns
Hands-on experience troubleshooting, optimizing, and enhancing the big data pipeline and bring improvements.
Experience & good proficiency with at least one programming language (Java, Scala, Python)
Extensive experience with at least one major Hadoop platform (Cloudera, Hortonworks, MapR)
Worked and deployed at least one data engineering application using cloud-native data platform and services (example EMR or Redshift in AWS or Data factory in Azure or BigQuery in GCP)
Strong troubleshooting and performance tuning skills.
Very well versed with continuous integration and deployment procedure considering the bigdata stack on-prem or cloud environment.
Ability to analyze business requirement user stories and translate them into system requirement specifications.
Experience working under the agile delivery methodology.
Behavioral Requirement
Demonstrated ability to work independently
Good communication skills and documentation skills.
Good & Collaborative Team Player.
Good organizational and time management skills
An ability to work to deadlines
A good eye for detail
Must be ready to learn and adapt to new technologies.


Qualifications Requirements
BE/BTech in computer science Or MCA with sound industry experience (2-4 years)
A minimum of 2 years' experience in hands-on development
Experience in Java, Scala or Python (Production level coding)
Experience in a cloud-based environment with PaaS & IaaS
Work iteratively in a team with continuous collaboration",Data Engineer,Bengaluru,2.9,Unknown / Non-Applicable,INR 58K - INR 63K,Information Technology,51 to 200 employees,Company - Private
"NICE Actimize
3.9","SAS, Feedzai",1999,"Hoboken, NJ",Computer Hardware & Software,"Position: Data Scientist

Location: Pune, India

NICE Actimize is comprised of talented, creative and dedicated individuals with a passion for delivering innovative solutions to the market. At NICE Actimize, we recognize that every employee’s contributions are integral to our company’s growth and success. To find and acquire the best and brightest talent around the globe, we offer a challenging work environment, competitive compensation and benefits, and rewarding career opportunities. Come share, grow and learn with us – you’ll be challenged, you’ll have fun and you’ll be part of a fast growing, highly respected organization.

NICE Actimize is currently seeking an experienced Data Scientist to join our dynamic and growing Fraud & AML Analytics Services team.

Responsibilities
Perform analysis to support the deployment of fraud prevention analytical models
Analyze fraud cases obtained from clients
Research data patterns in order to find patterns predictive of fraud
Improve the quality and actual implementation of computational algorithms and tools
Optimize the detection performance of NICE Actimize Fraud products and improve customers’ experience with our Fraud solutions
Define product requirements for analytics and provide feedback to the product team on ways in which product may be improved
Develop and enhance our solution-specific risk scores
Measure the quality of the analytical performance of Fraud Products
Develop tools to support model tuning, performance tracking and automation
Develop custom detection logic for specific clients
Help maintain and improve model development methodologies/practices.
Experience: 3 to 6 Years

Qualifications:
Advanced degree in a quantitative area (statistics, mathematics, physics, computer science, engineering)
Strong general analytical skills, Experience with statistical model development. Deep and diverse experience with multiple statistical procedures and data mining algorithms.
Strong experience with using SQL and EXCEL.
Strong programming skills in Python and ability to rapidly learn new programming tools.
Exposure to other programming languages: R, SAS, Scala, Java, Python, Matlab, SPSS, VBA, including procedures, macros, and scripting.
Experience of building and deploying classification and regression machine learning models at an enterprise level.
Good oral and written communications skills, and ability to interact with engineers, software developers, project managers, business analysts, product managers and with clients.
Ability to work in multi-disciplinary agile teams.
Strong commitment to quality
Customer facing experience – a plus
Innovative aptitude.
Additional Desired Qualifications:
Experience in development of risk management models, particularly in the fraud, AML, or financial trade compliance areas.
Knowledge of national and international financial systems and data standards.
Experience with Business Intelligence platforms, methodologies (e.g. OLAP), and tools.",Data Scientist,Pune,3.9,Unknown / Non-Applicable,"INR 2,315K - INR 2,544K",Information Technology,501 to 1000 employees,Subsidiary or Business Segment
"UnitedHealth Group
3.4","Aetna, Humana, WellPoint",1977,"Minnetonka, MN",Healthcare Services & Hospitals,"Position Description The data scientist will work in teams addressing statistical, Machine Learning and data understanding problems. In this role they will contribute to the development and deployment of Machine Learning, Operational Research, Semantic Analysis and statistical methods for finding structure in large data sets. Key responsibilities • Analysis of huge data set • Application of statistical methods for problem solving /analysis • Predictive modelling and supervise learning • Operational Research • Development of Unit Tests Other Responsibilities Analytical skills for problem solvingCommunication - Communicates clearly and concisely on a routine basis (verbally and in writing)Collaboration & Team Work - Works collaboratively with other members of the team by sharing ideas and informationExcellence in Execution - Works hard to meets the goals/ targets given, and is motivated by opportunities for reward and recognitionInnovation - Explores alternative approaches to achieving objectivesLearning & Applying - Focusses on learning and development as per the feedback provided for enhancing one's own performance",Data Scientist,Bengaluru,3.4,₹500+ billion (INR),"INR 1,288,781",Healthcare,10000+ employees,Company - Public
"PayPal
3.7","Square, Amazon, Apple",1998,"San Jose, CA",Internet,"Provide analytical insights into emerging problems, trends and portfolios
Work closely with business partners and stakeholders to determine how to design analysis and measurement approaches that will significantly improve our ability to understand and address emerging business issues
Bringing data to life and making it actionable and relevant to stakeholders through exploratory analysis of internal and external data sources using advanced and innovative analytical techniques, algorithms, and tools
Identifying present or future gaps in the teams existing reporting and tools suite and managing portfolio monitoring, dashboards and reporting
Providing regular updates to leadership, product and other stakeholders that will simplify and clarify complex concepts and the results of analyses effectively with emphasis on the actionable outcomes and impact to business
Experience with standard statistical techniques and tools a plus
Required Qualifications
Bachelor's Degree in a quantitative discipline (Economics, Engineering, Computer Science, Math, Statistics)
1-2 years experience in analytics or management consulting
Proficiency using SQL and querying relational databases
Experience in at least one statistical programming language (SAS, R, Python)
Experience in at least one data visualization tool (Tableau, Qlikview)
Experience with project management
Preferred Skills:
Strong communication skills
Quick learning
Out-of-box Problem Solving",Data Scientist,Bengaluru,3.7,₹500+ billion (INR),INR 227K - INR 627K,Information Technology,10000+ employees,Company - Public
"Amazon
4.3","Google, Microsoft, Walmart",1994,"Seattle, WA",Internet,"Amazon strives to be Earth's most customer-centric company where people can find and discover anything they want to buy online. We hire the world's brightest minds, offering them a fast paced, technologically sophisticated, and friendly work environment.

The FinAuto Data Engineering and Analytics team, part of Finance Automation Org focuses on the application of machine learning methods designed to enable Amazon to increase free cash flow by optimizing spend, expense, payroll defects. All of this work is performed in close coordination with senior business leaders. These are exciting fast-paced businesses in which we get to work on extremely interesting analytical problems, in an environment where you get to learn from other data engineers and apply econometric, statistics, and machine learning at massive scale.
As a member of the FinAuto Data Engineering and Analytics team, you will partner closely with a team of stake holders, payment teams, data engineers and software engineers.
In this role you will:
· Work with data engineers to design and implement machine learning applications and solutions.
· Implement and maintain a high-volume, highly available, hybrid (SQL + No SQL) data processing solutions that consists of structured and semi-structured data.
· Design and implement a very large distributed data warehousing and reporting solution and integrate it with business intelligence tools



Basic Qualifications

· 5+ years of experience in software development of large-scale data infrastructure and distributed systems
· 5+ years of experience in data extraction, transformation, statistical analysis and data modeling
· 5+ years of experience developing enterprise software using Java or Python
· 3+ years of experience in applying Data Mining and Machine Learning techniques to solve business problems
· 3+ years of experience using major RDBMS, Hadoop, Spark, Elasticsearch, or similar technologies
· 3+ years of experience with statistical modeling tools such as R, SAS, SciKit-learn, or TensorFlow
· Bachelors degree in Computer Science, Computer Engineering, Machine Learning, or related field or equivalent experience.

Preferred Qualifications

· Masters degree in Computer Science, Computer Engineering, Machine Learning, or related field; PhD a plus
· Deep expertise in Statistics, Machine Learning or related disciplines
· Advanced knowledge in performance, scalability, numerical accuracy, enterprise system architecture, best practices.
· Experience building solutions using AWS big data and machine learning services
· Ability to communicate complex technical concepts and solutions to all levels of the organization",Data Scientist,Hyderabad,4.3,₹500+ billion (INR),"INR 1,561,488",Information Technology,10000+ employees,Company - Public
"Punchh
4.2",-1,2010,"San Mateo, CA",Enterprise Software & Network Solutions,"Punchh creates the consistent, modern experiences consumers expect by bringing the power of identity resolution into physical retail. Punchh is the leader in delivering one-to-one customer engagement and loyalty beyond mobile devices for a consistent brand experience through every channel. The Punchh Loyalty and Engagement Platform, powered through artificial intelligence, guides consumers through their lifecycle from first-time customer to superfan, building meaningful relationships and dramatically increasing lifetime customer value. Nearly 200 global enterprise brands rely on Punchh to grow revenue by building customer relationships. The company is based in Silicon Valley, California with a second US office in Austin, TX and global offices across Canada, India, the United Kingdom, and Singapore.

Punchh, Jaipur is looking out for a Data Analyst, who will take ownership of data analytics activities and work closely with end users (both internal and external clients) to translate requirements into data-driven applications and data visualization solutions (e.g. reporting and dashboards)

Total and Relevant Experience Required: 2+ years

Job Location: Jaipur

Key Responsibilities:
Participate in client calls with senior executives who are based in different geography and hence different time zone to understand business needs and define reporting solutions
Work with the CS managers to develop an insightful analytics report for our clients. Make actionable business recommendations. Define performance measurement / KPI / recurring reports.
Be One of the key owners of the quarterly business review process that highlight the relevant business opportunities.
Be a key liaison between the data and CS teams to:
Address and resolve data requests.
Ensure high quality of our data warehouse.
Represent the company's expertise in advanced analytics in a variety of media outlets such as client interactions, conferences, blogs, and interviews.
Skillset Required
Relevant experience in analytics
Advanced degree in Data technology, business, economics, statistics or other related fields, with a strong interest in marketing technology.
Expertise in creating analytics dashboards using such as Tableau (preferably), Power BI, etc from various data sources.
Strong knowledge of and experience with databases (SQL, Redshift, Snowflake, etc.)
Self-starter, with a keen interest in technology and highly motivated towards success
Must be proactive and be prepared to address meeting in different time zones.
Good to have skillset: R, Python, Tableau Server, Big Data Tools like Databricks, Spark",Data Analyst,Jaipur,4.2,₹5 to ₹10 billion (INR),INR 289K - INR 311K,Information Technology,201 to 500 employees,Company - Private
